{"base_revision":"9aa3d36c72f2b0fa93c5f953d77804f42be2c305","context_policy_id":"context.subject_windows@3","ingest":{"max_file_bytes":4194304,"max_files":4096,"max_total_source_bytes":67108864,"profile_id":"rust.production.v1","profile_version":"1","rule_set_hash":"sha256:4b6cca93794ab03b1576e17d2e395ec43f731d316685247a89363ae2e840dd96"},"observer":{"kind":"deterministic_abstain"},"plan":{"max_obligations_per_wave":1024,"max_waves":1024},"repository_admission_root":".","repository_identity":"github.com/CAPHTECH/casegraphen","schema":"reviewgraphen.generic_review_request.v3","target_revision":"4adb8ef846aa964a9b4506829960ff4149fee63f","verifier_descriptor_id":"workspace.cargo_test@1","workspace_admission_root":"."}