{"base_revision":"0cb05688d3247f6ce4fc41777a85386b51ff9aa5","context_policy_id":"context.subject_windows@3","ingest":{"max_file_bytes":4194304,"max_files":20000,"max_total_source_bytes":67108864,"profile_id":"rust.production.v1","profile_version":"1","rule_set_hash":"sha256:4b6cca93794ab03b1576e17d2e395ec43f731d316685247a89363ae2e840dd96"},"observer":{"kind":"deterministic_abstain"},"plan":{"max_obligations_per_wave":1024,"max_waves":1024},"repository_admission_root":".","repository_identity":"github.com/CAPHTECH/reviewgraphen","schema":"reviewgraphen.generic_review_request.v3","target_revision":"7f8716d3695ccef7f6f134021d7775805ce68720","verifier_descriptor_id":"workspace.cargo_test@1","workspace_admission_root":"."}