{"base_revision":"e7f7314505512b068e857bb22cf25dd6315dfa43","context_policy_id":"context.subject_windows@3","ingest":{"max_file_bytes":4194304,"max_files":20000,"max_total_source_bytes":67108864,"profile_id":"rust.production.v1","profile_version":"1","rule_set_hash":"sha256:4b6cca93794ab03b1576e17d2e395ec43f731d316685247a89363ae2e840dd96"},"observer":{"kind":"deterministic_abstain"},"plan":{"max_obligations_per_wave":1024,"max_waves":1024},"repository_admission_root":".","repository_identity":"github.com/ymm-oss/fsl","schema":"reviewgraphen.generic_review_request.v3","target_revision":"027ba973275c2945504b53057693aed0a2eb9af1","verifier_descriptor_id":"workspace.cargo_test@1","workspace_admission_root":"."}