{"schema":"reviewgraphen.generic_review_request.v3","workspace_admission_root":"/workspace","repository_admission_root":"/workspace/repository","repository_identity":"example/repository","base_revision":"BASE","target_revision":"TARGET","ingest":{"profile_id":"rust.production.v1","profile_version":"1","rule_set_hash":"sha256:0000000000000000000000000000000000000000000000000000000000000000","max_files":64,"max_file_bytes":4194304,"max_total_source_bytes":67108864},"plan":{"max_waves":8,"max_obligations_per_wave":32},"observer":{"kind":"deterministic_abstain"},"verifier_descriptor_id":"workspace.cargo_test@1","context_policy_id":"context.subject_windows@3"}
